{
  "$schema": "http://json-schema.org/draft-07/schema#",
  "$id": "schema/upgrades.schema.json",
  "title": "Upgrades",
  "description": "Shape contract for shared/data/upgrades.json. Generated by tools/studio/gen-schemas.mjs — edit the generator, not this file.",
  "type": "object",
  "required": [
    "cosmeticTracks",
    "costFormula",
    "tracks",
    "version"
  ],
  "additionalProperties": false,
  "properties": {
    "$schema": {
      "type": "string"
    },
    "_comment": {
      "type": "string"
    },
    "cosmeticTracks": {
      "type": "array",
      "items": {
        "type": "object",
        "properties": {
          "currency": {
            "enum": [
              "embers"
            ]
          },
          "id": {
            "type": "string",
            "pattern": "^[a-z][a-z0-9_]*$"
          },
          "nameKey": {
            "type": "string"
          },
          "prices": {
            "type": "array",
            "items": {
              "type": "integer"
            }
          }
        },
        "required": [
          "currency",
          "id",
          "nameKey",
          "prices"
        ]
      }
    },
    "costFormula": {
      "type": "object",
      "properties": {
        "growth": {
          "type": "string"
        },
        "type": {
          "type": "string"
        }
      },
      "required": [
        "growth",
        "type"
      ]
    },
    "tracks": {
      "type": "array",
      "items": {
        "type": "object",
        "properties": {
          "baseCost": {
            "type": "integer"
          },
          "category": {
            "enum": [
              "charcoal",
              "employees",
              "grill",
              "prep",
              "prestige",
              "restaurant",
              "service"
            ]
          },
          "currency": {
            "enum": [
              "coins"
            ]
          },
          "descKey": {
            "type": "string"
          },
          "effect": {
            "type": "object",
            "properties": {
              "delta": {
                "type": "number"
              },
              "stat": {
                "type": "string"
              }
            },
            "required": [
              "delta",
              "stat"
            ]
          },
          "growth": {
            "type": "number"
          },
          "icon": {
            "type": "string"
          },
          "id": {
            "type": "string",
            "pattern": "^[a-z][a-z0-9_]*$"
          },
          "maxLevel": {
            "type": "integer"
          },
          "nameKey": {
            "type": "string"
          }
        },
        "required": [
          "baseCost",
          "category",
          "currency",
          "descKey",
          "effect",
          "growth",
          "icon",
          "id",
          "maxLevel",
          "nameKey"
        ]
      },
      "minItems": 20,
      "description": "§8 content floor: at least 20 entries."
    },
    "version": {
      "type": "integer"
    }
  }
}
